{
  "schema_version": "rehostrace.causal/v2",
  "trace_id": "public.bluetooth.rfcomm-hfp.control",
  "disclosure": "public-synthetic",
  "origin": {"kind": "synthetic", "producer": "rehostrace-rfcomm-hfp-fixture", "redactions": []},
  "clock_domains": [{"id": "fixture.sequence", "unit": "sequence", "synchronized": true}],
  "actors": [{"id": "host.stack", "kind": "host"}, {"id": "controller.irq", "kind": "interrupt"}],
  "resources": [{"id": "connection.classic", "kind": "synthetic-classic-connection", "identity": "logical"}],
  "events": [
    {"id": "e00.ready", "actor": "controller.irq", "kind": "link.state", "boundary": {"domain": "bluetooth.host-boundary", "operation": "hci.controller.ready", "direction": "target-in"}, "parents": [], "clock": {"domain": "fixture.sequence", "value": 0}, "attributes": {"command_credits": 1}},
    {"id": "e01.connected", "actor": "controller.irq", "kind": "link.state", "boundary": {"domain": "bluetooth.host-boundary", "operation": "hci.connection.complete", "direction": "target-in"}, "parents": ["e00.ready"], "subject": "connection.classic", "clock": {"domain": "fixture.sequence", "value": 1}, "attributes": {"status": 0, "handle": 64, "address_token": "public-peer", "link_type": "acl"}},
    {"id": "e02.rfcomm-open", "actor": "host.stack", "kind": "custom", "boundary": {"domain": "bluetooth.host-boundary", "operation": "rfcomm.session.open", "direction": "internal"}, "parents": ["e01.connected"], "clock": {"domain": "fixture.sequence", "value": 2}, "attributes": {"handle": 64, "session_id": "rfcomm.1", "role": "initiator"}},
    {"id": "e03.dlc-open", "actor": "host.stack", "kind": "custom", "boundary": {"domain": "bluetooth.host-boundary", "operation": "rfcomm.dlc.open", "direction": "internal"}, "parents": ["e02.rfcomm-open"], "clock": {"domain": "fixture.sequence", "value": 3}, "attributes": {"handle": 64, "session_id": "rfcomm.1", "dlci": 2, "initial_credits": 4}},
    {"id": "e04.slc-open", "actor": "host.stack", "kind": "custom", "boundary": {"domain": "bluetooth.host-boundary", "operation": "hfp.slc.open", "direction": "internal"}, "parents": ["e03.dlc-open"], "clock": {"domain": "fixture.sequence", "value": 4}, "attributes": {"handle": 64, "session_id": "hfp.1", "role": "hands-free", "rfcomm_session_id": "rfcomm.1", "dlci": 2}},
    {"id": "e05.at-command", "actor": "host.stack", "kind": "boundary.output", "boundary": {"domain": "bluetooth.host-boundary", "operation": "hfp.at.command", "direction": "target-out"}, "parents": ["e04.slc-open"], "clock": {"domain": "fixture.sequence", "value": 5}, "attributes": {"handle": 64, "session_id": "hfp.1", "command_id": "at.1", "command": "AT+BRSF"}},
    {"id": "e06.at-response", "actor": "controller.irq", "kind": "boundary.input", "boundary": {"domain": "bluetooth.host-boundary", "operation": "hfp.at.response", "direction": "target-in"}, "parents": ["e05.at-command"], "clock": {"domain": "fixture.sequence", "value": 6}, "attributes": {"handle": 64, "session_id": "hfp.1", "command_id": "at.1", "result": "ok"}},
    {"id": "e07.audio-connect", "actor": "host.stack", "kind": "link.state", "boundary": {"domain": "bluetooth.host-boundary", "operation": "hfp.audio.connect", "direction": "internal"}, "parents": ["e06.at-response"], "clock": {"domain": "fixture.sequence", "value": 7}, "attributes": {"handle": 64, "session_id": "hfp.1"}},
    {"id": "e08.data", "actor": "host.stack", "kind": "boundary.output", "boundary": {"domain": "bluetooth.host-boundary", "operation": "rfcomm.data", "direction": "target-out"}, "parents": ["e07.audio-connect"], "clock": {"domain": "fixture.sequence", "value": 8}, "attributes": {"handle": 64, "session_id": "rfcomm.1", "dlci": 2, "direction": "host-to-peer", "length": 7}},
    {"id": "e09.audio-disconnect", "actor": "host.stack", "kind": "link.state", "boundary": {"domain": "bluetooth.host-boundary", "operation": "hfp.audio.disconnect", "direction": "internal"}, "parents": ["e08.data"], "clock": {"domain": "fixture.sequence", "value": 9}, "attributes": {"handle": 64, "session_id": "hfp.1"}},
    {"id": "e10.slc-close", "actor": "host.stack", "kind": "custom", "boundary": {"domain": "bluetooth.host-boundary", "operation": "hfp.slc.close", "direction": "internal"}, "parents": ["e09.audio-disconnect"], "clock": {"domain": "fixture.sequence", "value": 10}, "attributes": {"handle": 64, "session_id": "hfp.1"}},
    {"id": "e11.dlc-close", "actor": "host.stack", "kind": "custom", "boundary": {"domain": "bluetooth.host-boundary", "operation": "rfcomm.dlc.close", "direction": "internal"}, "parents": ["e10.slc-close"], "clock": {"domain": "fixture.sequence", "value": 11}, "attributes": {"handle": 64, "session_id": "rfcomm.1", "dlci": 2}},
    {"id": "e12.rfcomm-close", "actor": "host.stack", "kind": "custom", "boundary": {"domain": "bluetooth.host-boundary", "operation": "rfcomm.session.close", "direction": "internal"}, "parents": ["e11.dlc-close"], "clock": {"domain": "fixture.sequence", "value": 12}, "attributes": {"handle": 64, "session_id": "rfcomm.1"}},
    {"id": "e13.disconnected", "actor": "controller.irq", "kind": "link.state", "boundary": {"domain": "bluetooth.host-boundary", "operation": "hci.disconnection.complete", "direction": "target-in"}, "parents": ["e12.rfcomm-close"], "clock": {"domain": "fixture.sequence", "value": 13}, "attributes": {"status": 0, "handle": 64, "reason": 19}}
  ]
}
